{
  "$schema": "https://json-schema.org/draft/2020-12/schema",
  "$id": "https://organchor.org/schemas/root-authority.v1.json",
  "type": "object",
  "required": ["schema", "type", "version", "authority_id", "created_at", "threshold", "keys"],
  "properties": {
    "schema": { "const": "https://organchor.org/schemas/root-authority.v1.json" },
    "type": { "const": "OrgAnchorRootAuthority" },
    "version": { "const": "1.0" },
    "authority_id": { "type": "string", "minLength": 1 },
    "created_at": {
      "type": "string",
      "pattern": "^\\d{4}-\\d{2}-\\d{2}T\\d{2}:\\d{2}:\\d{2}(?:\\.\\d{3})?Z$"
    },
    "threshold": {
      "type": "object",
      "required": ["required", "total"],
      "properties": {
        "required": { "type": "integer", "minimum": 1 },
        "total": { "type": "integer", "minimum": 1 }
      }
    },
    "keys": {
      "type": "array",
      "minItems": 1,
      "items": {
        "type": "object",
        "required": ["id", "algorithm", "public_key"],
        "properties": {
          "id": { "type": "string", "minLength": 1 },
          "algorithm": { "const": "ed25519" },
          "public_key": {
            "type": "object",
            "required": ["format", "jwk"],
            "properties": {
              "format": { "const": "jwk" },
              "jwk": {
                "type": "object",
                "required": ["kty", "crv", "x"],
                "properties": {
                  "kty": { "const": "OKP" },
                  "crv": { "const": "Ed25519" },
                  "x": { "type": "string", "pattern": "^[A-Za-z0-9_-]+$" }
                }
              }
            }
          }
        }
      }
    }
  }
}
